Disease,Description,Symptoms,Treatments
crohn's disease,"Crohn's disease is a type of inflammatory bowel disease that can affect any part of the gastrointestinal tract from mouth to anus. Symptoms include abdominal pain, diarrhea, and weight loss.","abdominal pain and cramping, diarrhea, blood in your stool, reduced appetite and weight loss, fatigue, fever","anti-inflammatory drugs, immune system suppressors, antibiotics, nutrition therapy, surgery"
cryptococcosis,"Cryptococcosis is a fungal infection caused by Cryptococcus neoformans or Cryptococcus gattii. It can affect the lungs, brain, and other parts of the body.","fever, headache, nausea and vomiting, stiff neck, sensitivity to light, confusion, shortness of breath","antifungal medications, amphotericin b, flucytosine, fluconazole"
cryptosporidiosis,"Cryptosporidiosis is a parasitic infection caused by the Cryptosporidium parasite. It can cause diarrhea, stomach cramps, nausea, and vomiting.","diarrhea, stomach cramps, nausea, vomiting, fever, dehydration","antiparasitic medications, nitazoxanide, azithromycin, rehydration therapy"
cystic fibrosis,"Cystic fibrosis is an inherited disorder that causes severe damage to the lungs, digestive system and other organs in the body. It affects the cells that produce mucus, sweat and digestive juices.","persistent cough with thick mucus, wheezing or shortness of breath, poor growth or weight gain, frequent respiratory infections, salty-tasting skin, difficulty with bowel movements","airway clearance techniques, inhaled medications, oral pancreatic enzyme supplements, antibiotics, nutrition therapy"
cytomegalovirus infection,"Cytomegalovirus (CMV) is a common virus that can infect people of all ages. Most people with CMV have no symptoms, but it can cause serious problems in people with weakened immune systems.","fever, fatigue, sore throat, swollen glands, muscle aches, loss of appetite, jaundice, pneumonia, encephalitis","antiviral medications, ganciclovir, valganciclovir, foscarnet"
deep vein thrombosis,"Deep vein thrombosis is a blood clot that forms in a vein deep inside the body, usually in the leg.","swelling in the affected leg, pain or tenderness in the affected leg, warmth in the skin over the affected leg, red or discolored skin over the affected leg, shortness of breath","anticoagulant medications to prevent the clot from getting bigger, thrombolytic therapy to dissolve the clot, compression stockings or devices to help prevent swelling and blood clots"
dementia,Dementia is a general term for a decline in mental ability severe enough to interfere with daily life. Memory loss is an example. Alzheimer's is the most common type of dementia.,"memory loss, difficulty communicating, inability to focus or pay attention, poor reasoning or judgment, confusion and disorientation, mood changes","medications to treat cognitive symptoms, antidepressants, antipsychotics, occupational therapy, speech therapy"
dengue,"an acute infectious disease caused by a flavivirus (species Dengue virus of the genus Flavivirus), transmitted by aedes mosquitoes, and characterized by headache, severe joint pain, and a rash. — called also breakbone fever, dengue fever."," skin rash,  chills,  joint pain,  vomiting,  fatigue,  high fever,  headache,  nausea,  loss of appetite,  pain behind the eyes,  back pain,  muscle pain,  red spots over body","drink papaya leaf juice, avoid fatty spicy food, keep mosquitos away, keep hydrated"
dengue fever,"Dengue fever is a viral infection transmitted by mosquitoes. It can cause a high fever, severe headache, joint and muscle pain, and a rash.","high fever, severe headache, joint and muscle pain, nausea and vomiting, rash, pain behind the eyes, fatigue","pain relievers, fluid replacement therapy, rest, preventing dehydration"
dental caries,"Dental caries, also known as tooth decay, is a common dental problem caused by the breakdown of tooth enamel by bacteria. It can lead to pain, infection, and tooth loss if left untreated.","toothache or pain when eating or drinking, sensitivity to hot or cold temperatures, visible holes or pits in the teeth, dark spots on the teeth, bad breath or a bad taste in the mouth","fillings to repair cavities, crowns to cover damaged teeth, root canal therapy to treat infections, tooth extraction in severe cases"
depression,"Depression is a mood disorder that can affect a person's thoughts, feelings, and behaviors. It can lead to feelings of sadness, hopelessness, and loss of interest in daily activities.","persistent feelings of sadness, anxiety, or emptiness, loss of interest in activities that were once enjoyable, difficulty sleeping or oversleeping, changes in appetite or weight, fatigue, difficulty concentrating or making decisions","antidepressant medications, psychotherapy, brain stimulation therapies (e.g., electroconvulsive therapy or transcranial magnetic stimulation)"
diabetes,"Diabetes is a disease that occurs when your blood glucose, also called blood sugar, is too high. Blood glucose is your main source of energy and comes from the food you eat. Insulin, a hormone made by the pancreas, helps glucose from food get into your cells to be used for energy."," fatigue,  weight loss,  restlessness,  lethargy,  irregular sugar level,  blurred and distorted vision,  obesity,  excessive hunger,  increased appetite,  polyuria","have balanced diet, exercise, consult doctor, follow up"
diabetes mellitus,Diabetes mellitus is a chronic metabolic disorder characterized by high blood sugar levels due to the body's inability to produce or use insulin effectively.,"increased thirst, frequent urination, extreme hunger, unexplained weight loss, fatigue, blurred vision, slow-healing sores or frequent infections, tingling or numbness in the hands or feet, dry, itchy skin","lifestyle changes (e.g. diet, exercise), oral medications (e.g. metformin, sulfonylureas), insulin therapy, blood sugar monitoring, regular check-ups with a healthcare provider"
dimorphic hemorrhoids (piles),"Hemorrhoids, also spelled haemorrhoids, are vascular structures in the anal canal."," constipation,  pain during bowel movements,  pain in anal region,  bloody stool,  irritation in anus","avoid fatty spicy food, consume witch hazel, warm bath with epsom salt, consume alovera juice"
diphtheria,Diphtheria is a bacterial infection that can cause severe respiratory and cardiac problems. It is spread through contact with an infected person or object.,"sore throat, fever, swollen glands in the neck, weakness and fatigue, difficulty breathing, nasal discharge, formation of a thick grayish coating in the throat and nose","antibiotics, diphtheria antitoxin, supportive care"
diverticulitis,Diverticulitis is a condition in which small pouches that form in the wall of the colon become infected or inflamed.,"abdominal pain, usually on the left side, fever, nausea, vomiting, constipation or diarrhea","antibiotics to treat the infection, liquid diet or low-fiber diet to help the colon rest, surgery to remove the affected part of the colon in severe cases"
down syndrome,"Down Syndrome is a genetic disorder that causes developmental and intellectual delays, as well as physical characteristics such as low muscle tone, upward slanting eyes, and a flat nasal bridge.","intellectual disability, delayed developmental milestones, hypotonia (low muscle tone), upward slanting eyes, flat nasal bridge, short stature, heart defects","early intervention and special education, speech and physical therapy, treatment of associated health issues"
drug reaction,An adverse drug reaction (ADR) is an injury caused by taking medication. ADRs may occur following a single dose or prolonged administration of a drug or result from the combination of two or more drugs.,"itching,  skin rash,  stomach pain,  burning micturition,  spotting  urination","stop irritation, consult nearest hospital, stop taking drug, follow up"
e. coli infection,E. coli infection is a type of foodborne illness caused by consuming food or water contaminated with the bacteria E. coli.,"abdominal pain, diarrhea, nausea, vomiting, fatigue, fever, bloody stool","supportive care, fluid replacement"
ebola virus disease,Ebola virus disease (EVD) is a rare but severe illness caused by the Ebola virus.,"fever, headache, muscle pain, fatigue, diarrhea, vomiting, abdominal pain, unexplained hemorrhage","supportive care, experimental treatments"
eczema,"Eczema is a chronic skin condition characterized by itchy, inflamed patches of skin. The cause of eczema is unknown, but it is thought to be related to an overactive immune system and a defective skin barrier.","itchy, red, and dry skin, thickened, cracked, or scaly skin, small bumps that may leak fluid, sensitive skin, discoloration of the skin","moisturizers and topical steroids, avoiding triggers (such as certain fabrics, soaps, or foods), antihistamines for itching, immunosuppressants for severe cases"
ehrlichiosis,Ehrlichiosis is a bacterial illness transmitted by ticks that causes flu-like symptoms.,"fever, headache, muscle aches, fatigue, nausea, vomiting, diarrhea, cough, joint pain, confusion","doxycycline, other antibiotics"
emphysema,"Emphysema is a lung disease that damages the air sacs in the lungs. This damage makes it harder to breathe and can lead to shortness of breath, coughing, and wheezing.","shortness of breath, especially during physical activities, wheezing, chest tightness, chronic cough, lack of energy","quitting smoking, medications such as bronchodilators, inhaled steroids, or oxygen therapy, pulmonary rehabilitation, lung volume reduction surgery, lung transplant"
encephalitis,"Encephalitis is inflammation of the brain, usually caused by a viral infection.","fever, headache, stiff neck, confusion, seizures, muscle weakness, personality changes, loss of consciousness","antiviral medications, steroids, supportive care"
endocarditis,Endocarditis is an infection of the lining of the heart or heart valves.,"fever, fatigue, shortness of breath, swelling in the legs, feet, or abdomen, heart murmur","antibiotics to treat the infection, surgery to repair or replace damaged heart valves, anticoagulant medications to prevent blood clots"
endometriosis,"Endometriosis is a condition where the tissue that normally lines the inside of the uterus grows outside of it, leading to pain and discomfort.","painful periods, pain during intercourse, painful bowel movements or urination during menstruation, excessive bleeding, infertility","pain relievers such as nonsteroidal anti-inflammatory drugs (nsaids), hormone therapy, surgery to remove endometrial tissue, assisted reproductive technologies (art)"
enterovirus infection,Enterovirus infection is a viral illness that can cause a range of symptoms from mild to severe.,"fever, headache, muscle aches, fatigue, rash, sore throat, runny nose, cough, diarrhea, vomiting, meningitis, encephalitis","supportive care, antiviral medications, pain and fever relief"
epilepsy,"Epilepsy is a neurological disorder that causes seizures, which can range from mild to severe and affect different parts of the brain.","seizures, temporary confusion, staring spells, loss of consciousness, psychic symptoms","antiepileptic drugs (aeds), surgery to remove the part of the brain causing seizures, vagus nerve stimulation (vns), ketogenic diet"
erectile dysfunction,Erectile dysfunction is the inability to get or maintain an erection firm enough for sexual intercourse.,"difficulty getting an erection, difficulty maintaining an erection, reduced sexual desire","oral medications such as sildenafil (viagra), tadalafil (cialis), or vardenafil (levitra), injections into the penis, penile implants"
erysipelas,"Erysipelas is a bacterial skin infection that usually affects the legs, but can also occur on the face, arms and other parts of the body. It is caused by group A streptococcus bacteria and is characterized by redness, warmth, and swelling of the affected area.","redness, warmth, and swelling of the skin, fever, chills, fatigue, pain and tenderness in the affected area, blisters and sores may develop","antibiotics, such as penicillin or erythromycin, pain relievers, such as acetaminophen or ibuprofen, elevating the affected limb to reduce swelling, resting and staying hydrated"
escherichia coli o157:h7 infection,"Escherichia coli O157:H7 is a strain of E. coli bacteria that can cause severe foodborne illness. It is typically spread through contaminated food or water and can lead to symptoms such as abdominal pain, diarrhea, and dehydration. In severe cases, it can cause kidney failure and other complications.","abdominal pain and cramping, diarrhea, often bloody, nausea and vomiting, dehydration, fever, fatigue","drinking plenty of fluids to prevent dehydration, antibiotics are not recommended for treating e. coli o157:h7 infection as they can increase the risk of kidney damage, in severe cases, hospitalization may be necessary"
esophageal cancer,Esophageal cancer is a type of cancer that begins in the cells that line the esophagus.,"difficulty swallowing, unintentional weight loss, chest pain or discomfort, heartburn or indigestion, chronic cough","surgery to remove the cancer, radiation therapy, chemotherapy, palliative care to manage symptoms in advanced cases"
fibromyalgia,"Fibromyalgia is a chronic condition that causes widespread pain and tenderness in the body, as well as fatigue, sleep disturbances, and cognitive difficulties.","widespread pain, tender points, fatigue, sleep disturbances, cognitive difficulties","pain relievers such as acetaminophen, nsaids, or opioids, antidepressants, anticonvulsants, physical therapy, counseling"
filariasis,"Filariasis is a parasitic infection that is transmitted by mosquitoes. It can lead to a variety of symptoms, including fever, lymphedema, and elephantiasis. The infection is common in many tropical and subtropical regions of the world.","swelling of the limbs, genitalia, or breasts, fever, chills, muscle and joint pain, fatigue, skin rash, lymphedema","antiparasitic medication, such as diethylcarbamazine, symptomatic treatment, such as pain relievers or antibiotics to treat secondary infections, preventive measures, such as mosquito control measures and the use of bed nets"
fungal infection,"In humans, fungal infections occur when an invading fungus takes over an area of the body and is too much for the immune system to handle. Fungi can live in the air, soil, water, and plants. There are also some fungi that live naturally in the human body. Like many microbes, there are helpful fungi and harmful fungi.","itching,  skin rash,  nodal skin eruptions,  dischromic  patches","bath twice, use detol or neem in bathing water, keep infected area dry, use clean cloths"
gallbladder cancer,"Gallbladder cancer is a cancerous growth in the gallbladder, a small organ located beneath the liver that stores bile.","abdominal pain, jaundice, nausea and vomiting, loss of appetite, weight loss","surgery to remove the gallbladder, chemotherapy, radiation therapy"
gallstones,"Gallstones are hardened deposits of digestive fluid that can form in the gallbladder, causing pain and other complications.","sudden and rapidly intensifying pain in the upper right portion of your abdomen, pain in the back between the shoulder blades, pain in the right shoulder, nausea, vomiting","surgery to remove the gallbladder (cholecystectomy), medications to dissolve gallstones, lithotripsy"
gastritis,Inflammation of the stomach lining,"abdominal pain, nausea, vomiting","antacids, proton pump inhibitors, dietary changes"
gastroenteritis,"Gastroenteritis is an inflammation of the digestive tract, particularly the stomach, and large and small intestines. Viral and bacterial gastroenteritis are intestinal infections associated with symptoms of diarrhea , abdominal cramps, nausea , and vomiting ."," vomiting,  sunken eyes,  dehydration,  diarrhoea","stop eating solid food for while, try taking small sips of water, rest, ease back into eating"
gastroesophageal reflux disease,"Gastroesophageal reflux disease (GERD) is a chronic condition in which acid reflux occurs more than twice a week, causing inflammation and irritation of the esophagus.","heartburn, regurgitation, difficulty swallowing, chest pain","antacids, proton pump inhibitors, h2 blockers, lifestyle changes (e.g., weight loss, avoiding trigger foods)"
gerd,"Gastroesophageal reflux disease, or GERD, is a digestive disorder that affects the lower esophageal sphincter (LES), the ring of muscle between the esophagus and stomach. Many people, including pregnant women, suffer from heartburn or acid indigestion caused by GERD."," stomach pain,  acidity,  ulcers on tongue,  vomiting,  cough,  chest pain","avoid fatty spicy food, avoid lying down after eating, maintain healthy weight, exercise"
giardiasis,Giardiasis is a diarrheal illness caused by the microscopic parasite Giardia.,"diarrhea, abdominal cramps, bloating, nausea, fatigue, loss of appetite, weight loss","antibiotics, anti-diarrheal medications, rehydration therapy"
glaucoma,Damage to the optic nerve that can lead to vision loss,"blurred vision, eye pain, headaches","eye drops, laser surgery, trabeculectomy"
glomerulonephritis,"Glomerulonephritis is a type of kidney disease in which the tiny filters in the kidneys become inflamed and damaged, leading to kidney failure.","blood in the urine, foamy urine, swelling in the face, hands, or feet, high blood pressure","medications to control blood pressure and reduce inflammation, dialysis, kidney transplant"
gonorrhea,Gonorrhea is a sexually transmitted infection caused by the bacterium Neisseria gonorrhoeae.,"painful urination, abnormal discharge, painful intercourse, lower abdominal pain, fever","antibiotics, pain relief medication, rest, safe sex practices"
gout,A type of arthritis caused by a buildup of uric acid crystals in the joints,"intense joint pain, swelling, redness","nonsteroidal anti-inflammatory drugs (nsaids), colchicine, urate-lowering therapy"
graves' disease,"Graves' disease is an autoimmune disorder that causes hyperthyroidism, or overactive thyroid.","anxiety and irritability, weight loss, rapid or irregular heartbeat","anti-thyroid medication such as methimazole or propylthiouracil, radioactive iodine therapy, surgery to remove the thyroid gland"
group a streptococcal infection,Group A streptococcal infection is a bacterial infection caused by group A streptococcus.,"fever, sore throat, swollen lymph nodes, nausea, vomiting, abdominal pain, rash","antibiotics, pain relief medication, rest"
haemophilus influenzae infection,Haemophilus influenzae infection is a bacterial infection caused by Haemophilus influenzae.,"fever, headache, stiff neck, fatigue, ear pain, difficulty breathing","antibiotics, pain relief medication, rest"
hantavirus pulmonary syndrome,Hantavirus pulmonary syndrome is a rare but serious respiratory disease caused by hantavirus.,"fever, muscle aches, fatigue, shortness of breath, cough, headaches, abdominal pain","hospitalization, oxygen therapy, fluid replacement therapy"
hashimoto's thyroiditis,"Hashimoto's thyroiditis is an autoimmune disorder that causes hypothyroidism, or underactive thyroid.","fatigue and sluggishness, weight gain, depression","synthetic thyroid hormone replacement therapy, lifestyle changes such as a healthy diet and exercise, avoiding certain foods such as soy and high-fiber foods"
hearing loss,Hearing loss is the partial or total inability to hear sounds.,"difficulty hearing conversations, muffling of speech and other sounds, ringing in the ears","hearing aids, cochlear implants, assistive listening devices"
heart attack,"The death of heart muscle due to the loss of blood supply. The loss of blood supply is usually caused by a complete blockage of a coronary artery, one of the arteries that supplies blood to the heart muscle.","chest pain or discomfort, upper body pain or discomfort in the arms, back, neck, jaw, or stomach, shortness of breath, nausea or vomiting, lightheadedness, dizziness, or fainting, sweating","aspirin, thrombolytics (clot-busting drugs), antiplatelet drugs, coronary angioplasty and stenting, coronary artery bypass surgery"
heart failure,Heart failure is a chronic condition in which the heart is unable to pump enough blood to meet the body's needs.,"shortness of breath, fatigue, swelling in the legs, ankles, or feet, coughing or wheezing, rapid or irregular heartbeat","medications to improve heart function and control symptoms, lifestyle changes (e.g., reducing salt intake, exercising regularly), surgery (e.g., implanting a pacemaker, heart transplant)"
helminthiasis,Helminthiasis is a parasitic disease caused by helminths.,"abdominal pain, diarrhea, nausea, vomiting, fever, fatigue, weight loss","antiparasitic medications, surgery (in some cases)"
hemophilia,"Hemophilia is a genetic disorder that affects the body's ability to clot blood, leading to excessive bleeding and easy bruising.","excessive bleeding, frequent nosebleeds, blood in the urine or stool","replacement therapy with clotting factors, desmopressin to increase the levels of clotting factors, gene therapy"
hemorrhoids,Swollen veins in the anus and lower rectum,"bleeding, pain or discomfort, itching","over-the-counter creams or ointments, sitz baths, surgery"
hepatitis a,Hepatitis A is a highly contagious liver infection caused by the hepatitis A virus. The virus is one of several types of hepatitis viruses that cause inflammation and affect your liver's ability to function.,"fatigue, nausea and vomiting, abdominal pain, loss of appetite, dark urine, joint pain, jaundice","rest, adequate nutrition, fluids, vaccination"
hepatitis b,"Hepatitis B is an infection of your liver. It can cause scarring of the organ, liver failure, and cancer. It can be fatal if it isn't treated. It's spread when people come in contact with the blood, open sores, or body fluids of someone who has the hepatitis B virus.","fever, fatigue, loss of appetite, nausea, vomiting, abdominal pain, joint pain, jaundice","antiviral medication, rest, adequate nutrition, fluids, vaccination"
hepatitis c,"Inflammation of the liver due to the hepatitis C virus (HCV), which is usually spread via blood transfusion (rare), hemodialysis, and needle sticks. The damage hepatitis C does to the liver can lead to cirrhosis and its complications as well as cancer.","fever, fatigue, joint pain, muscle pain, loss of appetite, nausea, vomiting, abdominal pain, dark urine, jaundice","antiviral medication, rest, adequate nutrition, fluids"
hepatitis d,"Hepatitis D, also known as the hepatitis delta virus, is an infection that causes the liver to become inflamed. This swelling can impair liver function and cause long-term liver problems, including liver scarring and cancer. The condition is caused by the hepatitis D virus (HDV)."," joint pain,  vomiting,  fatigue,  yellowish skin,  dark urine,  nausea,  loss of appetite,  abdominal pain,  yellowing of eyes","consult doctor, medication, eat healthy, follow up"
hepatitis e,A rare form of liver inflammation caused by infection with the hepatitis E virus (HEV). It is transmitted via food or drink handled by an infected person or through infected water supplies in areas where fecal matter may get into the water. Hepatitis E does not cause chronic liver disease.," joint pain,  vomiting,  fatigue,  high fever,  yellowish skin,  dark urine,  nausea,  loss of appetite,  abdominal pain,  yellowing of eyes,  coma,  stomach bleeding","stop alcohol consumption, rest, consult doctor, medication"
hernia,A bulge or protrusion of an organ or tissue through an abnormal opening in the abdominal wall,"a visible bulge, pain or discomfort, nausea or vomiting","watchful waiting, hernia truss, surgery"
herpes zoster,"Herpes zoster, also known as shingles, is a viral infection that causes a painful rash.","pain, burning, or tingling on one side of the body, a rash that appears as a band or stripe on one side of the body, blisters that break open and crust over, itching, fever, headache, sensitivity to light","antiviral medication, pain relievers, topical creams or gels, cool, wet compresses, rest"
hiatal hernia,"Hiatal hernia is a condition in which a portion of the stomach protrudes upward into the chest, through an opening in the diaphragm.","heartburn, acid reflux, difficulty swallowing, chest or abdominal pain, shortness of breath","antacids, medications to reduce acid production, surgery (in severe cases)"
high blood pressure (hypertension),"High blood pressure is a common condition in which the force of blood against your artery walls is consistently too high, which can eventually cause health problems, such as heart disease.","headaches, shortness of breath, nosebleeds, flushed face, dizziness, chest pain, visual changes","lifestyle changes (e.g., healthy diet, regular exercise, stress management), medications (e.g., ace inhibitors, diuretics, beta blockers), monitoring blood pressure regularly"
high cholesterol,"High cholesterol is a condition in which you have too much cholesterol — a waxy, fat-like substance — in your blood. High cholesterol can increase your risk of heart disease and other health problems.","none (usually asymptomatic), yellowish patches around the eyes, xanthomas (fatty deposits) on the elbows, knees, and tendons","lifestyle changes (e.g., healthy diet, regular exercise, quitting smoking), medications (e.g., statins, bile acid sequestrants, niacin), monitoring cholesterol levels regularly"
histoplasmosis,Histoplasmosis is a fungal infection caused by inhaling spores of the fungus Histoplasma capsulatum. It can cause flu-like symptoms and can be severe in people with weakened immune systems.,"fever, cough, chest pain, fatigue, body aches","antifungal medications, oxygen therapy, intravenous fluids"
