Disease,Description,Symptoms,Treatments
acne,"Acne vulgaris is the formation of comedones, papules, pustules, nodules, and/or cysts as a result of obstruction and inflammation of pilosebaceous units (hair follicles and their accompanying sebaceous gland). Acne develops on the face and upper trunk. It most often affects adolescents.","blackheads, whiteheads, pimples, cysts, nodules","topical creams and gels containing benzoyl peroxide or retinoids, oral medications such as antibiotics or isotretinoin, chemical peels, laser and light therapies"
adenoiditis,"Adenoiditis is an inflammation of the adenoids, which are small pads of tissue located in the back of the throat.","difficulty breathing through the nose, snoring, mouth breathing","antibiotics, nasal decongestants, surgery to remove the adenoids"
aids,"Acquired immunodeficiency syndrome (AIDS) is a chronic, potentially life-threatening condition caused by the human immunodeficiency virus (HIV). By damaging your immune system, HIV interferes with your body's ability to fight infection and disease.","fever, fatigue, swollen lymph nodes, rapid weight loss, frequent infections, skin rashes, night sweats, chronic diarrhea, persistent cough, memory loss, depression, neurological disorders","antiretroviral therapy, prophylaxis for opportunistic infections, supportive care"
alcoholic hepatitis,"Alcoholic hepatitis is a diseased, inflammatory condition of the liver caused by heavy alcohol consumption over an extended period of time. It's also aggravated by binge drinking and ongoing alcohol use. If you develop this condition, you must stop drinking alcohol"," vomiting,  yellowish skin,  abdominal pain,  swelling of stomach,  distention of abdomen,  history of alcohol consumption,  fluid overload","stop alcohol consumption, consult doctor, medication, follow up"
allergy,"An allergy is an immune system response to a foreign substance that's not typically harmful to your body.They can include certain foods, pollen, or pet dander. Your immune system's job is to keep you healthy by fighting harmful pathogens."," continuous sneezing,  shivering,  chills,  watering from eyes","apply calamine, cover area with bandage, use ice to compress itching"
alzheimer's disease,"Alzheimer's disease is a progressive brain disorder that affects memory, thinking, and behavior. It is the most common cause of dementia in older adults.","memory loss, difficulty completing familiar tasks, language problems, disorientation, mood swings, personality changes, loss of motivation","medications, non-drug treatments (e.g., cognitive stimulation therapy), supportive therapies, clinical trials"
amyotrophic lateral sclerosis (als),"A progressive neurodegenerative disease that affects nerve cells in the brain and spinal cord, leading to muscle weakness and eventual paralysis.","muscle weakness and stiffness, difficulty speaking and swallowing, muscle twitching and cramping, gradual loss of mobility, difficulty breathing","medications to manage symptoms, physical therapy and occupational therapy, assistive devices to help with mobility and communication"
anal fissure,"An anal fissure is a tear in the lining of the anus, which can cause pain and bleeding during bowel movements.","pain during bowel movements, bleeding from the anus, itching or burning around the anus","stool softeners, topical analgesics, surgery in severe cases"
anemia,"A condition in which the body lacks enough red blood cells or hemoglobin, leading to reduced oxygen supply to tissues and organs.","fatigue and weakness, shortness of breath, dizziness, headache, pale skin, irregular heartbeat","supplements to increase iron or vitamin levels, blood transfusions, medications to stimulate red blood cell production"
angina pectoris,Angina pectoris is a condition that causes chest pain or discomfort. It occurs when the heart muscle doesn't get enough blood and oxygen due to narrowed or blocked coronary arteries.,"chest pain or discomfort, pain or discomfort in the arms, neck, jaw, shoulder or back, shortness of breath","lifestyle changes such as quitting smoking, eating a healthy diet and exercising regularly, medications to relieve pain and improve blood flow to the heart, medical procedures such as angioplasty or bypass surgery"
anthrax,"Anthrax is a serious bacterial infection caused by the spore-forming bacterium Bacillus anthracis, which can affect both humans and animals.","flu-like symptoms, skin lesions, swelling, fever, chest discomfort, shortness of breath, nausea and vomiting, abdominal pain, headache, confusion","antibiotics, antitoxins, wound care"
anxiety disorders,"A group of mental health disorders characterized by excessive worry, fear, or nervousness that interferes with daily activities.","excessive worrying, feeling restless or on edge, irritability, difficulty concentrating, muscle tension, sleep problems, panic attacks","therapy to learn coping strategies, medications to manage symptoms, lifestyle changes to promote relaxation and stress management"
aortic stenosis,"Aortic stenosis is a condition that occurs when the aortic valve narrows, restricting blood flow from the heart to the rest of the body.","shortness of breath, chest pain or discomfort, fainting or lightheadedness","medications to manage symptoms, balloon valvuloplasty to open the narrowed valve, surgical valve replacement"
aortic valve regurgitation,"Aortic valve regurgitation is a condition that occurs when the aortic valve doesn't close properly, causing blood to leak back into the heart.","shortness of breath, fatigue, swollen ankles or feet","medications to manage symptoms, surgical valve repair or replacement"
appendicitis,"Appendicitis is a condition where the appendix becomes inflamed and swollen, usually as a result of an infection.","pain in the lower right side of the abdomen, nausea and vomiting, loss of appetite, fever, constipation or diarrhea","surgery to remove the appendix, antibiotics to treat the infection, pain medication"
arthritis,"Arthritis is the swelling and tenderness of one or more of your joints. The main symptoms of arthritis are joint pain and stiffness, which typically worsen with age. The most common types of arthritis are osteoarthritis and rheumatoid arthritis.","joint pain and stiffness, swelling and redness around the joint, limited range of motion, fatigue, fever","pain medication, anti-inflammatory drugs, physical therapy, joint replacement surgery"
asthma,"Asthma is a chronic condition where the airways in the lungs become inflamed and narrow, making it difficult to breathe.","wheezing, coughing, shortness of breath, chest tightness, difficulty breathing","bronchodilators to open up the airways, corticosteroids to reduce inflammation, leukotriene modifiers, immunomodulators"
atherosclerosis,"Atherosclerosis is a condition where plaque builds up inside the arteries, making them narrower and restricting blood flow.","chest pain, shortness of breath, weakness or numbness in limbs, headache, blurry vision","lifestyle changes such as quitting smoking and eating a healthy diet, medications to lower cholesterol and blood pressure, angioplasty or stenting to open up blocked arteries, surgery to bypass blocked arteries"
autism spectrum disorder,"A neurodevelopmental disorder characterized by social, communication, and behavioral challenges that can vary widely in severity.","difficulty with social interactions, delayed or absent language development, repetitive behaviors or routines, narrow interests, sensory sensitivities","behavioral therapy to teach social and communication skills, medications to manage co-occurring conditions, lifestyle changes to support overall health and well-being"
autoimmune disorders,Autoimmune disorders refer to a group of diseases in which the immune system attacks healthy cells in the body by mistake.,"fatigue, joint pain and swelling, skin problems, abdominal pain, digestive problems, fever, swollen glands, muscle pain","anti-inflammatory medications, immunosuppressant drugs, corticosteroids, physical therapy, surgery (in severe cases)"
avian influenza,"Avian influenza, also known as bird flu, is a highly contagious viral infection that primarily affects birds but can also infect humans.","fever, cough, sore throat, muscle aches, fatigue, headache, difficulty breathing, pneumonia, acute respiratory distress syndrome, multi-organ failure","antiviral drugs, supportive care, vaccines (for birds)"
bacterial meningitis,"Bacterial meningitis is a serious infection of the meninges, which are the protective membranes that surround the brain and spinal cord.","fever, headache, stiff neck, nausea and vomiting, sensitivity to light, confusion, seizures, coma","antibiotics, corticosteroids, supportive care"
benign prostatic hyperplasia,"Benign prostatic hyperplasia is a condition that causes the prostate gland to enlarge, leading to urinary problems.","frequent urination, difficulty starting or stopping urination, weak urine stream","medications to relax the muscles of the prostate gland and improve urine flow, minimally invasive procedures such as transurethral microwave therapy or laser therapy, surgery to remove the prostate gland"
bipolar disorder,"Bipolar disorder is a mental illness characterized by extreme mood swings, including episodes of mania and depression.","mood swings, mania (extreme high), depression (extreme low), fatigue, insomnia, irritability, difficulty concentrating, impaired judgment, risk-taking behavior","mood stabilizing medications, antidepressants, antipsychotic medications, psychotherapy, electroconvulsive therapy (ect) (in severe cases)"
blood clotting disorders,"Blood clotting disorders refer to a group of conditions in which the blood clots too easily or doesn't clot enough, leading to an increased risk of bleeding or clotting.","abnormal bleeding, bruising, blood in urine or stool, swelling, pain, redness, warmth in the affected area","blood thinners, anticoagulants, platelet inhibitors, iron supplements (in some cases)"
botulism,"Botulism is a rare but serious bacterial infection caused by the toxin produced by the bacterium Clostridium botulinum, which can lead to paralysis and even death.","double vision, blurred vision, drooping eyelids, slurred speech, difficulty swallowing, dry mouth, muscle weakness, paralysis, respiratory failure","antitoxin, ventilation support, intensive care"
brain tumors,Brain tumors refer to abnormal growths of cells in the brain that can be cancerous (malignant) or non-cancerous (benign).,"headaches, seizures, nausea and vomiting, memory problems, changes in vision, hearing, or speech, difficulty walking or balancing, weakness or numbness on one side of the body","surgery, radiation therapy, chemotherapy, steroids, anti-seizure medications"
breast cancer,Breast cancer is a type of cancer that forms in the cells of the breast.,"a lump or thickening in the breast or underarm, changes in the size or shape of the breast, nipple discharge or retraction","surgery to remove the cancerous tissue, radiation therapy to destroy cancer cells, chemotherapy or targeted therapy to kill cancer cells"
bronchial asthma,"Bronchial asthma is a medical condition which causes the airway path of the lungs to swell and narrow. Due to this swelling, the air path produces excess mucus making it hard to breathe, which results in coughing, short breath, and wheezing. The disease is chronic and interferes with daily working."," fatigue,  cough,  high fever,  breathlessness,  family history,  mucoid sputum","switch to loose cloothing, take deep breaths, get away from trigger, seek help"
bronchitis,"Bronchitis is an inflammation of the lining of the bronchial tubes, which carry air to and from the lungs.","persistent cough, mucus production, wheezing, shortness of breath, chest discomfort","rest and hydration, over-the-counter cough medicine, inhaled bronchodilators, corticosteroids, antibiotics (if bacterial)"
brucellosis,"Brucellosis is a bacterial infection that spreads from animals to people, usually through unpasteurized dairy products or contact with bodily fluids from infected animals.","fever, fatigue, loss of appetite, joint pain, muscle pain, sweating, headache","antibiotics, rest, pain relievers"
bursitis,"Bursitis is an inflammation of the bursae, which are small sacs of fluid that cushion the joints and reduce friction between bones and soft tissues.","joint pain, swelling and redness, stiffness and limited range of motion","rest and ice, anti-inflammatory medication, physical therapy"
campylobacteriosis,"Campylobacteriosis is a bacterial infection that causes diarrhea, abdominal pain, and fever. It is usually contracted through contaminated food, particularly undercooked poultry.","diarrhea, abdominal pain, fever, nausea, vomiting","fluids, antibiotics, rest"
candidiasis,"Candidiasis is a fungal infection caused by the overgrowth of yeast. It can occur in various parts of the body, including the mouth, throat, genitals, and skin.","redness, itching, burning, swelling, white patches on the tongue or inside the mouth, pain during sex, discharge","antifungal medication, topical creams, oral medication"
cardiomyopathy,"Cardiomyopathy is a disease that affects the heart muscle, making it harder for the heart to pump blood to the rest of the body.","shortness of breath, swelling of the legs, ankles, or feet, fatigue, irregular heartbeat","lifestyle changes (e.g., diet, exercise), medications (e.g., ace inhibitors, beta blockers), implanted devices (e.g., pacemakers, defibrillators), surgery (e.g., heart transplant)"
carotid artery disease,"Carotid artery disease occurs when the carotid arteries, which supply blood to the brain, become narrowed or blocked by plaque buildup.","transient ischemic attacks (mini-strokes), weakness or numbness on one side of the body, trouble speaking or understanding speech, dizziness","lifestyle changes (e.g., diet, exercise), medications (e.g., blood thinners, cholesterol-lowering drugs), endarterectomy (surgical removal of plaque from artery), angioplasty and stenting (using a balloon to widen the artery and placing a stent to hold it open)"
cataracts,"Cataracts are a clouding of the eye's natural lens, which can cause blurry vision and eventually blindness if left untreated.","blurred or dimmed vision, difficulty seeing at night, sensitivity to light, frequent changes in eyeglass or contact lens prescription","prescription eyeglasses or contact lenses, surgery to remove and replace the clouded lens"
celiac disease,"Celiac disease is an autoimmune disorder in which the body's immune system attacks the small intestine when gluten is ingested, leading to damage and malabsorption of nutrients.","abdominal pain and bloating, diarrhea or constipation, fatigue, weight loss, iron-deficiency anemia","a gluten-free diet, supplements to correct nutrient deficiencies"
cerebral aneurysm,"A cerebral aneurysm is a weakened, bulging area in the wall of an artery in the brain that can rupture and cause bleeding in the brain.","severe headache, nausea and vomiting, stiff neck, blurred or double vision","observation and monitoring (for small, unruptured aneurysms), endovascular coiling (placing coils in the aneurysm to block blood flow), clipping (placing a clip on the base of the aneurysm to prevent it from rupturing), surgical removal of the aneurysm"
cerebral palsy,"Cerebral palsy is a group of disorders that affect movement and muscle tone or posture. It is caused by damage that occurs to the immature brain as it develops, most often before birth.","muscle stiffness, muscle weakness, lack of muscle coordination, tremors, difficulty with fine motor skills, difficulty with gross motor skills, difficulty with swallowing or speaking","physical therapy, occupational therapy, speech therapy, medications for muscle spasticity or seizures, surgery in some cases"
cervical cancer,"Cervical cancer is a type of cancer that occurs in the cells of the cervix, which is the lower part of the uterus that connects to the vagina.","abnormal vaginal bleeding, pain during sex, pelvic pain, unusual vaginal discharge","surgery (e.g., hysterectomy, removal of lymph nodes), radiation therapy, chemotherapy, targeted therapy"
cervical spondylosis,"Cervical spondylosis is a general term for age-related wear and tear affecting the spinal disks in your neck. As the disks dehydrate and shrink, signs of osteoarthritis develop, including bony projections along the edges of bones (bone spurs)."," back pain,  weakness in limbs,  neck pain,  dizziness,  loss of balance","use heating pad or cold pack, exercise, take otc pain reliver, consult doctor"
chagas disease,"Chagas disease is a parasitic infection caused by the protozoan Trypanosoma cruzi. It is primarily found in Latin America, where it is transmitted to humans through the bite of infected triatomine bugs.","fever, fatigue, body aches, swollen lymph nodes, headache, enlarged liver or spleen, heart palpitations","antiparasitic medication, symptomatic treatment"
chicken pox,"Chickenpox is a highly contagious disease caused by the varicella-zoster virus (VZV). It can cause an itchy, blister-like rash. The rash first appears on the chest, back, and face, and then spreads over the entire body, causing between 250 and 500 itchy blisters.","itching,  skin rash,  fatigue,  lethargy,  high fever,  headache,  loss of appetite,  mild fever,  swelled lymph nodes,  malaise,  red spots over body","use neem in bathing , consume neem leaves, take vaccine, avoid public places"
chickenpox,Chickenpox is a highly contagious viral infection that causes an itchy rash and blisters. It is primarily spread through direct contact with an infected person or through airborne transmission.,"fever, fatigue, loss of appetite, headache, itchy rash, blisters, body aches","antiviral medication, symptomatic treatment"
chlamydia,A common sexually transmitted infection caused by the bacterium Chlamydia trachomatis.,"painful urination, abnormal vaginal discharge, pain during sex","antibiotics, pain relievers, abstaining from sexual activity"
cholecystitis,"Cholecystitis is an inflammation of the gallbladder, which is a small organ located near the liver that stores bile.","abdominal pain, nausea and vomiting, fever and chills","antibiotics, pain medication, surgery to remove the gallbladder in severe cases"
cholera,An acute diarrheal illness caused by the bacterium Vibrio cholerae.,"profuse watery diarrhea, vomiting, dehydration","rehydration therapy, antibiotics, zinc supplements"
chronic bronchitis,Chronic bronchitis is a type of chronic obstructive pulmonary disease (COPD) that causes inflammation and narrowing of the airways in the lungs.,"persistent cough, shortness of breath, chest tightness","bronchodilators, corticosteroids, oxygen therapy in severe cases"
chronic cholestasis,"Chronic cholestatic diseases, whether occurring in infancy, childhood or adulthood, are characterized by defective bile acid transport from the liver to the intestine, which is caused by primary damage to the biliary epithelium in most cases","itching,  vomiting,  yellowish skin,  nausea,  loss of appetite,  abdominal pain,  yellowing of eyes","cold baths, anti itch medicine, consult doctor, eat healthy"
chronic kidney disease,Chronic kidney disease (CKD) is a condition characterized by a gradual loss of kidney function over time. It can lead to kidney failure if left untreated.,"fatigue, weakness, loss of appetite, swelling in the legs, difficulty sleeping, changes in urination (e.g., frequency, color, or smell)","medications to control blood pressure and cholesterol levels, dietary changes to manage potassium, sodium, and protein intake, dialysis or kidney transplant in severe cases"
chronic obstructive pulmonary disease,"Chronic obstructive pulmonary disease (COPD) is a chronic lung disease characterized by obstruction of airflow from the lungs, making it difficult to breathe.","shortness of breath, especially during physical activities, wheezing, chest tightness, chronic cough, frequent respiratory infections, lack of energy, unintended weight loss","smoking cessation, bronchodilators to relax the muscles around the airways, inhaled corticosteroids to reduce inflammation, pulmonary rehabilitation to improve lung function and overall fitness, supplemental oxygen therapy, surgery in severe cases"
cirrhosis,"Cirrhosis is a late stage of liver disease in which healthy liver tissue is replaced with scar tissue, impairing liver function and leading to a range of symptoms.","fatigue and weakness, loss of appetite and weight loss, nausea and vomiting, abdominal swelling and pain, jaundice (yellowing of the skin and eyes)","treatment of underlying causes (e.g., alcohol cessation, hepatitis treatment), medications to manage symptoms, liver transplant in severe cases"
cirrhosis of the liver,"Cirrhosis is a late stage of scarring of the liver caused by long-term liver damage. It can lead to liver failure and other complications such as bleeding, infections, and liver cancer.","fatigue, weakness, loss of appetite, nausea and vomiting, abdominal pain and swelling, jaundice, itchy skin, easy bruising and bleeding, spider-like blood vessels on the skin","medications to manage complications, dietary changes to limit salt and fluid intake, alcohol abstinence, liver transplant"
coccidioidomycosis,A fungal infection caused by inhaling spores of the Coccidioides fungus.,"cough, fever, chest pain","antifungal medications, rest, pain relievers"
colitis,"Colitis is an inflammation of the colon, which can cause a range of symptoms depending on the underlying cause.","abdominal pain and cramping, diarrhea or constipation, rectal bleeding, urgent bowel movements, fever and fatigue","anti-inflammatory medications, immunosuppressants, surgery to remove the colon in severe cases"
colorectal cancer,"Colorectal cancer is a type of cancer that affects the colon and/or rectum. It often starts as a polyp, which can eventually become cancerous if left untreated.","abdominal pain, blood in the stool, changes in bowel habits (e.g., diarrhea or constipation), unintended weight loss, fatigue","surgery to remove the cancerous tissue, radiation therapy, chemotherapy, immunotherapy"
common cold,"The common cold is a viral infection of your nose and throat (upper respiratory tract). It's usually harmless, although it might not feel that way. Many types of viruses can cause a common cold.","runny nose, sore throat, cough","rest, fluids, over-the-counter medications for symptom relief"
congenital heart defects,"Congenital heart defects are abnormalities in the heart's structure that are present at birth. They can affect the heart's valves, chambers, or blood vessels.","blue or gray skin color, shortness of breath, fatigue, swelling in the legs, abdomen, or areas around the eyes, delayed growth and development (in infants and children)","surgery to repair the heart defect, medications to control symptoms, heart transplant in severe cases"
congestive heart failure,"Congestive heart failure occurs when the heart is unable to pump enough blood to meet the body's needs. It can lead to symptoms such as shortness of breath, fatigue, and swelling in the legs and ankles.","shortness of breath, fatigue, swelling in the legs, ankles, or feet, rapid or irregular heartbeat, chest pain, persistent cough or wheezing, lack of appetite, confusion or impaired thinking","medications to manage symptoms and improve heart function, lifestyle changes such as diet and exercise, implantation of devices such as pacemakers or defibrillators, heart transplant"
conjunctivitis,"Conjunctivitis, also known as pink eye, is an inflammation of the conjunctiva, which is the thin, clear tissue that lines the inside of the eyelid and covers the white part of the eye.","redness in the white of the eye or inner eyelid, increased amount of tears, thick yellow discharge that crusts over the eyelashes, especially after sleep, itchy or burning eyes, blurred vision, sensitivity to light","artificial tears, antihistamine eye drops, topical corticosteroids, cold compresses, warm compresses"
coronary artery disease,Coronary artery disease is a condition in which the arteries that supply blood to the heart become narrowed or blocked due to plaque buildup.,"chest pain or discomfort, shortness of breath, heart palpitations, nausea, sweating","lifestyle changes such as a healthy diet and exercise, medications such as aspirin and statins, procedures such as angioplasty or bypass surgery"
covid-19,"COVID-19 is the disease caused by a new coronavirus called SARS-CoV-2. It is a kind of virus that causes an infection in your nose, sinuses, or upper throat. The most recently discovered coronavirus causes coronavirus disease COVID-19.","fever, dry cough, fatigue, loss of taste or smell, nasal congestion, conjunctivitis (also known as red eyes), sore throat, headache, muscle or joint pain, different types of skin rash, nausea or vomiting, diarrhea, chills or dizziness","getting enough rest, staying well hydrated, and taking medications to relieve fever and aches and pains., communication with a treating physician and promptly report in case of any worsening., fda approved medicines like remdesivir, paxlovid, molnupiravir, tocilizumab"
creutzfeldt-jakob disease,"A rare and fatal brain disorder caused by prions, abnormal proteins that damage brain cells.","rapidly progressive dementia, muscle stiffness, difficulty with coordination and movement",there is no cure or treatment that can slow the progression of the disease
